paragraph,label,query,output,error,temporal_relation,,negation,noun event
"approximately one month later, in june 2021, ms. arvan went out onto the floor and walked past the roll tunnel. as she did so, she noticed that rivera was pushing the rolls of paper (which weigh thousands of pounds) with his hands. ms. arvan, consistent with the the companys requirement that managers intervene when they observe unsafe behavior, approached rivera to address his unsafe conduct. ms. arvan told rivera that the rolls were too heavy to be pushed with his hands. he responded that she was picking on him. ms. arvan said no, she was simply trying to have a case: 1:22-cv-00174-sjd doc #: 4 filed: 04/04/22 page: 7 of 16 pageid #: 111 8 safety discussion with him. ms. arvan advised rivera that he should not be pushing rolls, that his conduct was unsafe and that he could get hurt. she advised him that he needed to use a roll pusher. when ms. arvan advised him that the roll actually weighed 3,700 pounds and that he needed to use a roll pusher, he became more agitated and disrespectful and rolled his eyes at ms. arvan. ms. arvan said, dont roll your eyes at me.",no,Does ms. arvan observing the floor and the activities happening there follows she noticed rivera pushing the rolls of paper with his hands?,yes,yes,after,,x,
"plaintiff, trachte building systems, inc. (trachte) brings this action against defendant sheet metal air, rail and transportation workers local 565 (local 565) to vacate an arbitration award (award) and amended arbitration award (amended award) entered in smart local 565 v. trachte building systems, inc., case id trachte is an employer within the meaning of the lmra, 29 u.s.c. 152(2), and is engaged in commerce or an industry affecting commerce within the meaning of 29 u.s.c. 152(6) and (7). trachte is a wisconsin corporation engaged in the design, manufacture, and erection of durable, pre-engineered, and customized steel self-storage systems. its headquarters are located at 314 wilburn road, sun prairie, wisconsin, 53590, and its operations include a production plant in sun prairie, wisconsin (the sun prairie plant). case: 3:24-cv-00018 document #: 1 filed: 01/11/24 page 1 of 6 2 13, which requires a party challenging an arbitration award in wisconsin to file such challenge within 3 months after the award is filed or delivered. trachte received the award on december 1, 2023, and the amended award on december 11,",yes,Does trachte and local 565 reaching an agreement on the collective bargaining agreement precedes the plaintiff action against defendant?,no,yes,before,,,
"plaintiff, trachte building systems, inc. (trachte) brings this action against defendant sheet metal air, rail and transportation workers local 565 (local 565) to vacate an arbitration award (award) and amended arbitration award (amended award) entered in smart local 565 v. trachte building systems, inc., case id trachte is an employer within the meaning of the lmra, 29 u.s.c. 152(2), and is engaged in commerce or an industry affecting commerce within the meaning of 29 u.s.c. 152(6) and (7). trachte is a wisconsin corporation engaged in the design, manufacture, and erection of durable, pre-engineered, and customized steel self-storage systems. its headquarters are located at 314 wilburn road, sun prairie, wisconsin, 53590, and its operations include a production plant in sun prairie, wisconsin (the sun prairie plant). case: 3:24-cv-00018 document #: 1 filed: 01/11/24 page 1 of 6 2 13, which requires a party challenging an arbitration award in wisconsin to file such challenge within 3 months after the award is filed or delivered. trachte received the award on december 1, 2023, and the amended award on december 11,",yes,"Does trachte violating the terms of the collective bargaining agreement precedes trachte receiving the amended award on december 11,?",no,yes,before,,,
"however, after speaking with defendant ip martinez and being persuaded that he would support pantojas efforts to place lodge 2198 under supervision and to stop corruption at the iam, pantoja agreed not to run against defendant cervantes.\ , ""after the election, pantoja formally asked the executive council to place local 2198 under supervision. defendant gst cervantes, through defendant bryant, who was the gvp assigned to assist her, opposed supervision and campaigned to have the executive council case 1:22-cv-02512 document 1 filed 08/22/22 page 6 of 18 7 vote against taking any action. despite defendant ip martinezs assurances to pantoja that he would help to stop the corruption at local 2198, the executive council rejected pantoja s motion."", ""several months later, pantoja again demanded that the iam take remedial action; and, the executive council finally voted to impose supervision. ultimately, local lodge 2198 filed a 2018 form lm-2 with the u.s. department of labor, in which it acknowledged that there was a shortage attributable to local lodge 2198",no,Does pantoja's demanding for supervision follows the executive council realizing the need for supervision?,yes,yes,after,,,
"on november 25, 2020, the district court granted the unions summary judgment motion and denied cdrts. cdrt subsequently appealed the matter to the united states court of appeals for the sixth circuit (no. 20-6425). on september 17, 2021, however, the company and the union entered a settlement agreement that resolved the appeal. the settlement agreement is attached as exhibit d. in the settlement agreement, the parties agreed that they would arbitrate the sole issue of the calculation of backpay, as that remedy is referred to and defined in the july 24, 2019 opinion and award of arbitrator mark c. travis. they further agreed that this arbitration would be before arbitrator travis. case 3:22-cv-00386-rgj document 1 filed 07/27/22 page 4 of 9 pageid #: 4 5 the remedy award",no,Does the event of cdrt filing an appeal precedes the district court granting the union's summary judgment motion and denying cdrt?,yes,yes,before,,,
", ""on or about february 19, 2021, defendants martinez, allen, blondin, wallace, bryant and galloway signed a letter endorsing defendant cervantes that cervantes posted on her campaign website. in the letter, defendants make clear that they believed that pantoja orchestrated andermans nomination and stated that pantojas actions in endorsing anderman threatens to tear our union apart at a time when our members during the campaign, defendant richard johnsen, who had been promoted to be defendant ip martinezs chief of staff, stated that pantoja would be removed from his position as gvp-transportation because of his opposition to defendant cervantes. on or about march 19, 2021, the iam provided some of the documents pantoja requested in redacted form and withheld a number of the requested weekly expense reports.\",no,Does the promotion of richard johnsen to chief of staff follows the signing of the letter endorsing cervantes?,yes,yes,after,,,x
"despite no change in audreys need for daily skilled nursing services and no change in the language of the plan, after january 22, 2021 bcbsil began denying mr. lous claims for audreys care. on february 16, 2021, bcbsil denied mr. lous request for benefits for the period from january 28, 2021 through april 30, as grounds for denying the benefits, bcbsils denial letter stated only that [b]ased on your plan, our records show that the proposed services are not a covered benefit. because of this, any claims for these services would not be eligible for reimbursement. on april 13, 2021, maxim healthcare services (maxim), the provider of skilled nursing services to audrey, submitted an administrative appeal of bcbsils claim denial on mr. lous behalf. in support of its appeal, maxim submitted letters of medical necessity from dr. john takayama, audreys primary care physician, and dr. ngoc ly, audreys pulmonologist and chief of pediatric pulmonology at ucsf benioff childrens hospital. the letters both (1) established audreys ongoing need for daily skilled nursing care; and (2) evidenced the fact that audreys need for daily skilled nursing care had not changed nor diminished over the period for which claims were submitted. mr. lou and his wife also personally attested to audreys ongoing need for daily medical assessment and skilled nursing care in support of the appeal. maxim also submitted extensive nursing care documentation evidencing audreys need for daily skilled nursing care.",no,Does bcbsil began denying mr. lou's claims for audrey's care precedes there was no change in audrey's need for daily skilled nursing services?,yes,yes,before,,,
"the union members concerted refusal to work is a violation of the contracts and interfered with patient care and caused the hospital damages. count i breach of contract section 301 of the lmra, 29 u.s.c. 185 the union authorized the union members concerted refusal to pick up extra shifts on holidays. upon information and belief, the union authorized the union members concerted action of storming meetings and offices during work hours. case 3:23-cv-00466 document 1 filed 04/13/23 page 7 of 10 8",yes,Does the hospital being notified about the union members' actions is simultaneous with the union members interfering with patient care?,no,yes,simultaneous,,x,
", ""on or about february 19, 2021, defendants martinez, allen, blondin, wallace, bryant and galloway signed a letter endorsing defendant cervantes that cervantes posted on her campaign website. in the letter, defendants make clear that they believed that pantoja orchestrated andermans nomination and stated that pantojas actions in endorsing anderman threatens to tear our union apart at a time when our members during the campaign, defendant richard johnsen, who had been promoted to be defendant ip martinezs chief of staff, stated that pantoja would be removed from his position as gvp-transportation because of his opposition to defendant cervantes. on or about march 19, 2021, the iam provided some of the documents pantoja requested in redacted form and withheld a number of the requested weekly expense reports.\",no,Does the decision to promote johnsen follows the event of martinez promoting johnsen as his chief of staff?,yes,yes,after,,,x
"the pension plan is a tax-qualified, defined benefit pension plan covered under title iv of erisa. in march 2022, as a result of a pbgc premium filing review, pbgc discovered that safety light has failed to pay required pension plan premiums since 2018 and has also failed to make required pension plan contributions since in response to this finding, pbgc commenced an investigation into safety lights failure to make necessary payments to the pension plan, pursuant to the authority granted to pbgc under 29 u.s.c. 1303(a). case 2:22-cv-04603 document 1 filed 11/17/22 page 4 of 47 5",no,"Does the failure to pay pension plan premiums happens follows with the failure to make required pension plan contributions, both following safety light's neglect of their payment responsibilities?",    no,yes,after,,,x
"plaintiff, trachte building systems, inc. (trachte) brings this action against defendant sheet metal air, rail and transportation workers local 565 (local 565) to vacate an arbitration award (award) and amended arbitration award (amended award) entered in smart local 565 v. trachte building systems, inc., case id trachte is an employer within the meaning of the lmra, 29 u.s.c. 152(2), and is engaged in commerce or an industry affecting commerce within the meaning of 29 u.s.c. 152(6) and (7). trachte is a wisconsin corporation engaged in the design, manufacture, and erection of durable, pre-engineered, and customized steel self-storage systems. its headquarters are located at 314 wilburn road, sun prairie, wisconsin, 53590, and its operations include a production plant in sun prairie, wisconsin (the sun prairie plant). case: 3:24-cv-00018 document #: 1 filed: 01/11/24 page 1 of 6 2 13, which requires a party challenging an arbitration award in wisconsin to file such challenge within 3 months after the award is filed or delivered. trachte received the award on december 1, 2023, and the amended award on december 11,",yes,Does the event of brings (plaintiff action against defendant) is simultaneous with vacate (an arbitration award and amended arbitration award)?,no,yes,simultaneous,,,
", ""the complaint attached as exhibit 1 on its face, or within its four corners, meets the good cause standard described above. giving specific examples, the complaint sets out the spurious reasons for this repeated first-class air travel houston at iam expenses. none of the casual, often vague reasons explain why such travel had anything to do with her official responsibilities as the second highest ranking union officer, in charge of the iam financial affairs. and the conduct here is especially egregious because, under the iam constitution, she case 8:24-cv-00454-dkc document 1 filed 02/15/24 page 4 of 8 5 has a special obligation as general secretary treasurer to protect the union treasury and the membership from such misappropriation. among other purposes for this travel, defendant cervantes has nothing to do with collective bargaining, has no need to attend the local meetings, has no need to attend local get out the vote drives, has no need to engage in membership training, and especially has no need to do it in houston and nowhere else. upon becoming an international officer of iam, cervantes was moved at considerable iam expense to upper marlboro, maryland, where the iam has its headquarters. for iam accounting purposes, her official domicile is upper marlboro, maryland. even if her immediate family is in houston, texas, she is supposed to travel there on her own time and only at her own expense. the applicant sandra gardner learned of the misuse of union funds only in march 2021, when sito pantoja, the iam vice president at the time, obtained copies of her weekly expense reports from 2015 through united states district court for the district of connecticut women &amp; infants hospital of rhode island, plaintiff, vs. c.a. no. new england health care employees union, district 1199, seiu, defendant. women &amp; infants hospitals complaint pursuant to section 301 of the labor management relations act of 1947 (the lmra), 29 u.s.c. 185, women &amp; infants hospital of rhode island (the hospital) brings this complaint against new england health care employees union, district 1199, seiu (the union) seeking damages as a direct and proximate result of the union inducing, encouraging, and directing union members employed by the hospital to violate the parties collective bargaining agreements by engaging in a partial or complete cessation of work, strike, slowdown, or work stoppage, in addition to declaratory and injunctive relief. the union has engaged in such conduct beginning in may 2022 and as recently as march 15,"",  venue is proper in this court because the union maintains a principal office in and regularly transacts business in the district of connecticut. the duly authorized officers and case 3:23-cv-00466 document 1 filed 04/13/23 page 1 of 10 2 agents of the union are engaged in representing and acting for the employee members of the union in the district of connecticut. parties",yes,Does the union directing union members to engage in work stoppages also precedes the hospital seeking damages as a direct and proximate result of the union's actions?,“Yes”,yes,before,,,
"ms. reed advised ms. salome to issue the written discipline and to speak with rivera (as well as the other roll tunnel operators) regarding the defaced guidelines. accordingly, ms. salome, along with clint kelch (the union steward) approached rivera to present him with the disciplinary warning and to discuss the defacement of the posted guidelines. rivera was on his clamp truck and ms. salome advised that rivera that she needed to speak with him. without stopping, rivera told her that he did not have time to speak with her (his own supervisor) because he was working and drove by her.",yes,Does ms. reed advising ms. salome precedes ms. salome agreeing to ms. reed's advice?,no,yes,before,,,
"approximately one month later, in june 2021, ms. arvan went out onto the floor and walked past the roll tunnel. as she did so, she noticed that rivera was pushing the rolls of paper (which weigh thousands of pounds) with his hands. ms. arvan, consistent with the the companys requirement that managers intervene when they observe unsafe behavior, approached rivera to address his unsafe conduct. ms. arvan told rivera that the rolls were too heavy to be pushed with his hands. he responded that she was picking on him. ms. arvan said no, she was simply trying to have a case: 1:22-cv-00174-sjd doc #: 4 filed: 04/04/22 page: 7 of 16 pageid #: 111 8 safety discussion with him. ms. arvan advised rivera that he should not be pushing rolls, that his conduct was unsafe and that he could get hurt. she advised him that he needed to use a roll pusher. when ms. arvan advised him that the roll actually weighed 3,700 pounds and that he needed to use a roll pusher, he became more agitated and disrespectful and rolled his eyes at ms. arvan. ms. arvan said, dont roll your eyes at me.",yes,Does rivera pushing the rolls with his hands precedes ms. arvan's intervention?,    answer: yes,yes,before,,,x
"on november 25, 2020, the district court granted the unions summary judgment motion and denied cdrts. cdrt subsequently appealed the matter to the united states court of appeals for the sixth circuit (no. 20-6425). on september 17, 2021, however, the company and the union entered a settlement agreement that resolved the appeal. the settlement agreement is attached as exhibit d. in the settlement agreement, the parties agreed that they would arbitrate the sole issue of the calculation of backpay, as that remedy is referred to and defined in the july 24, 2019 opinion and award of arbitrator mark c. travis. they further agreed that this arbitration would be before arbitrator travis. case 3:22-cv-00386-rgj document 1 filed 07/27/22 page 4 of 9 pageid #: 4 5 the remedy award",yes,Does the agreement to arbitrate the calculation of backpay precedes the parties have entered a settlement agreement?,no,yes,before,,,x
"as part of its investigation, pbgc requested by letter dated march 9, 2022, that safety light provide to pbgc certain documents and information relating to the plan and the financial condition of safety light (information request letter). pbgc sent the information request letter via electronic mail to silverthorn. see exhibit c. case 2:22-cv-04603 document 1 filed 11/17/22 page 10 of 47 3 on april 12, 2022, pbgc issued a subpoena to safety light under 29 u.s.c. 1303(b) requiring production of the previously requested documents and information on or before may 3, 2022 (safety light subpoena). see exhibit e. respondents failed to respond to the safety light subpoena within the time prescribed. however, on may 4, 2022, after an email following up on the safety light subpoena, silverthorn requested an extension to respond until the end of may. pbgc agreed to the extension, with the understanding that documents would be provided on a rolling basis. respondents did not meet this new deadline nor communicate with pbgc in the interim.",no,Does safety light's failure to respond to the subpoena within the prescribed time follows silverthorn's request for an extension?,yes,yes,after,,,x
"ms. reed advised ms. salome to issue the written discipline and to speak with rivera (as well as the other roll tunnel operators) regarding the defaced guidelines. accordingly, ms. salome, along with clint kelch (the union steward) approached rivera to present him with the disciplinary warning and to discuss the defacement of the posted guidelines. rivera was on his clamp truck and ms. salome advised that rivera that she needed to speak with him. without stopping, rivera told her that he did not have time to speak with her (his own supervisor) because he was working and drove by her.",yes,Does ms. salome approaching rivera to present him with the disciplinary warning follows ms. reed's advice to ms. salome?,    answer: yes,yes,after,,,x
"less than 3 months have passed since the award and the amended award were delivered. true and accurate copies of the award and the amended award are attached as exhibits 1 and trachte and local 565 are parties to a collective bargaining agreement (the cba) covering employees represented by local 565 at the sun prairie plant. a true and accurate copy of the cba is attached as exhibit article 9, section 1 of the cba outlines a four-step procedure to resolve grievances. if a grievance has not been resolved by the time the four-step process is exhausted, then the grievance may be appealed to arbitration. for grievances involving a termination, the cba provides the grievance process starts at step",no,Does the application of the cba precedes the start of the grievance process for grievances involving a termination?,yes,yes,before,,,x
"the union members concerted refusal to work is a violation of the contracts and interfered with patient care and caused the hospital damages. count i breach of contract section 301 of the lmra, 29 u.s.c. 185 the union authorized the union members concerted refusal to pick up extra shifts on holidays. upon information and belief, the union authorized the union members concerted action of storming meetings and offices during work hours. case 3:23-cv-00466 document 1 filed 04/13/23 page 7 of 10 8",yes,Does the hospital being notified about the union members' actions is simultaneous with the union members interfering with patient care?,no,yes,simultaneous,,x,
"plaintiff, trachte building systems, inc. (trachte) brings this action against defendant sheet metal air, rail and transportation workers local 565 (local 565) to vacate an arbitration award (award) and amended arbitration award (amended award) entered in smart local 565 v. trachte building systems, inc., case id trachte is an employer within the meaning of the lmra, 29 u.s.c. 152(2), and is engaged in commerce or an industry affecting commerce within the meaning of 29 u.s.c. 152(6) and (7). trachte is a wisconsin corporation engaged in the design, manufacture, and erection of durable, pre-engineered, and customized steel self-storage systems. its headquarters are located at 314 wilburn road, sun prairie, wisconsin, 53590, and its operations include a production plant in sun prairie, wisconsin (the sun prairie plant). case: 3:24-cv-00018 document #: 1 filed: 01/11/24 page 1 of 6 2 13, which requires a party challenging an arbitration award in wisconsin to file such challenge within 3 months after the award is filed or delivered. trachte received the award on december 1, 2023, and the amended award on december 11,",yes,"Does trachte engaging in commerce or an industry affecting commerce precedes trachte engaging in the design, manufacture, and erection of steel self-storage systems?",no,yes,before,,,
"plaintiff, trachte building systems, inc. (trachte) brings this action against defendant sheet metal air, rail and transportation workers local 565 (local 565) to vacate an arbitration award (award) and amended arbitration award (amended award) entered in smart local 565 v. trachte building systems, inc., case id trachte is an employer within the meaning of the lmra, 29 u.s.c. 152(2), and is engaged in commerce or an industry affecting commerce within the meaning of 29 u.s.c. 152(6) and (7). trachte is a wisconsin corporation engaged in the design, manufacture, and erection of durable, pre-engineered, and customized steel self-storage systems. its headquarters are located at 314 wilburn road, sun prairie, wisconsin, 53590, and its operations include a production plant in sun prairie, wisconsin (the sun prairie plant). case: 3:24-cv-00018 document #: 1 filed: 01/11/24 page 1 of 6 2 13, which requires a party challenging an arbitration award in wisconsin to file such challenge within 3 months after the award is filed or delivered. trachte received the award on december 1, 2023, and the amended award on december 11,",yes,Does trachte and local 565 reaching an agreement on the collective bargaining agreement precedes the vacate action on an arbitration award and amended arbitration award?,no,yes,before,,,
"the parties have not agreed to empower arbitrators to establish or enforce supplemental early retirement benefits, or any benefit exclusively reserved to administration under the plan, to retirees. this court has the authority to determine the rights of the parties in connection with their dispute, namely whether the january 8 grievance should be arbitrated or pursued through the plan. , ""this dispute is ripe for adjudication, as the january 8 grievance is currently pending to be arbitrated. the parties have agreed to stay the arbitration pending the final disposition of this action in the united states courts.",no,Does initiating a grievance follows the agreement to stay the arbitration pending the final disposition of this action in the united states courts?,    no,yes,after,,,x
